id,queue_rule_key,display_order,rule_group,condition_key,condition_json,sort_order,action_key,description_id,recommended_for_mvp,source_url,notes
srs_queue_001,learning_due_first,1,gather,state_due,"{""state"": [""learning"", ""relearning""], ""due_at_lte"": ""now""}",due_at ASC,include_first,Learning/relearning yang sudah due selalu muncul dulu.,true,https://docs.ankiweb.net/deck-options.html,Queue behavior for daily review session.
srs_queue_002,review_overdue_second,2,gather,review_due,"{""state"": ""review"", ""due_at_lte"": ""now""}","due_at ASC, priority_order ASC",include_second,Review yang due/overdue muncul sebelum kartu baru.,true,https://docs.ankiweb.net/deck-options.html,Queue behavior for daily review session.
srs_queue_003,new_cards_last,3,gather,new_available,"{""state"": ""new"", ""daily_new_limit_remaining_gt"": 0}","priority_order ASC, created_at ASC",include_last,Kartu baru muncul setelah review biar backlog nggak meledak.,true,https://docs.ankiweb.net/deck-options.html,Queue behavior for daily review session.
srs_queue_004,cap_daily_reviews,4,limit,review_count,"{""max_reviews_per_day_from_deck"": true}",,stop_when_limit_reached,Batasi review harian per deck.,true,https://docs.ankiweb.net/deck-options.html,Queue behavior for daily review session.
srs_queue_005,pause_new_when_backlog,5,limit,backlog_threshold,"{""overdue_reviews_gt"": ""backlog_review_threshold""}",,skip_new_cards,"Kalau review numpuk, stop kartu baru dulu.",true,https://docs.ankiweb.net/deck-options.html,Queue behavior for daily review session.
srs_queue_006,bury_siblings,6,dedupe,same_source_entity,"{""bury_siblings"": true, ""scope"": ""deck_day""}",,hide_sibling_until_tomorrow,Jangan tampilkan kartu saudara di hari yang sama.,true,https://docs.ankiweb.net/deck-options.html,Queue behavior for daily review session.
srs_queue_007,leech_tagging,7,maintenance,lapse_count,"{""lapse_count_gte"": ""leech_threshold""}",,add_tag_leech,Kartu yang sering salah ditandai leech.,true,https://docs.ankiweb.net/deck-options.html,Queue behavior for daily review session.
srs_queue_008,timezone_rollover,8,time,day_boundary,"{""strategy"": ""user_local_midnight""}",,reset_daily_limits,Daily limit reset mengikuti timezone user.,true,https://docs.ankiweb.net/deck-options.html,Queue behavior for daily review session.
